{
  "schema": "plcidf.easy521-feedback.v1",
  "record_kind": "observation",
  "feedback_id": "easy521-visible-blink-20261019-01",
  "iteration_id": "easy521-led-20261019T033737Z",
  "parent_iteration_id": null,
  "requirement_revision": "EAI-R05-isolated-y0-blink",
  "program": {
    "source_sha256": "6c51789d485457f9fc64ff34c2f0101f6c10db61bce1bd2a0f529c2c0111e7ed",
    "source_tree_sha256": null,
    "build_hash": "4d92b527829f8ca570d28127e6d080b8d5733a1af8d97fa136a9813946a657f8",
    "intent_hash": null,
    "release_hash": null,
    "device_binary_sha256": null,
    "device_program_binding": "unverified"
  },
  "target": {
    "profile_id": "easy521",
    "observed_model": "Easy521",
    "observed_firmware": null,
    "observed_serial": null,
    "identity_quality": "unverified",
    "locator": {
      "kind": "vendor-usb",
      "value": "7-2"
    }
  },
  "observations": [
    {
      "recorded_at": "2026-10-19T03:41:19.849938+00:00",
      "observed_at": null,
      "source": {
        "kind": "human",
        "actor": "用户本人现场观察；AI按本会话原意转录",
        "evidence": [
          {
            "path": "evidence/easy521-power-20261019T031500Z/led-download-intent.json",
            "sha256": "d26724706804452cf94885426a6c962a1588881e7f7ef95e2b84402fe9f085f4",
            "source": "human-provided-file"
          },
          {
            "path": "evidence/easy521-power-20261019T031500Z/033752306315-ui-log-data-7d89a4.json",
            "sha256": "eb6f8d5308bf12fc0737a04fb85b7290680afbcfd61c08f248827c08f4c1eeb7",
            "source": "human-provided-file"
          },
          {
            "path": "evidence/easy521-power-20261019T031500Z/033919989347-ui-dialog-90e2c2.json",
            "sha256": "164f25c120f93e2fc15dfba34fcea1331df10c55de98466900e2985651bb3fa6",
            "source": "human-provided-file"
          }
        ]
      },
      "action": {
        "kind": "observe",
        "description": "在完整灯应用下载和程序校验后，用户观察面板指示灯。",
        "operation_id": "easy521-led-20261019T033737Z",
        "result": "performed"
      },
      "expected": "Y0跟随M8013，面板输出指示灯出现持续可见闪烁。",
      "actual": {
        "quality": "observed",
        "description": "用户原话：我这边已经很明显的看到外面的这个指示灯在闪烁。用户确认明显闪烁，但本条没有明确复述灯旁Y0或0丝印。",
        "value": null,
        "unit": null
      },
      "outcome": "unknown",
      "limitations": [
        "用户未提供精确观察时间，observed_at保持null；outcome不自动提升为形式化pass。",
        "人工观察证明用户看到了明显闪烁，未测量Y0端子电压、电流、负载能力、占空比或精确周期。",
        "厂商程序校验属于工程一致性，没有设备二进制字节读回或序列号核验。",
        "采集工具只核对记录结构、时间与本地附件哈希；未核验来源、设备或现场事实。"
      ]
    }
  ]
}
